subfield,year,rank,work_id,title,authors_top3,concepts_top3,abstract_preview,primary_source
operating systems,2020,9,https://openalex.org/W2583504027,The Delphi Technique: Making Sense of Consensus,Chia-Chien Hsu; Brian A. Sandford,Respondent (0.81); Delphi method (0.75); Delphi (0.74),The Delphi technique is a widely used and accepted method for gathering data from respondents within their domain of expertise. The technique is designed as a group communication process which aims to achieve a convergence of opinion on a specific real-world issue. The Delphi process has been used i...,Scholarworks (University of Massachusetts Amherst)
operating systems,2020,10,https://openalex.org/W2998789541,The Image Biomarker Standardization Initiative: Standardized Quantitative Radiomics for High-Throughput Image-based Phenotyping,Alex Zwanenburg; Martin Vallières; Mahmoud A. Abdalah,Standardization (0.68); Biomarker (0.65); Benchmark (surveying) (0.61),"Background Radiomic features may quantify characteristics present in medical imaging. However, the lack of standardized definitions and validated reference values have hampered clinical use. Purpose To standardize a set of 174 radiomic features. Materials and Methods Radiomic features were assessed ...",Radiology
operating systems,2020,11,https://openalex.org/W3047879827,The ARRIVE guidelines 2.0: Updated guidelines for reporting animal research,Nathalie Percie du Sert; Viki Hurst; Amrita Ahluwalia,Rigour (0.94); Checklist (0.75); Transparency (behavior) (0.66),Reproducible science requires transparent reporting. The ARRIVE guidelines (Animal Research: Reporting of In Vivo Experiments) were originally developed in 2010 to improve the reporting of animal research. They consist of a checklist of information to include in publications describing in vivo exper...,Experimental Physiology
operating systems,2020,12,https://openalex.org/W3035028232,AGREE—Analytical GREEnness Metric Approach and Software,Francisco Pena‐Pereira; W. Wojnowski; Marek Tobiszewski,Calculator (0.66); Automation (0.64); Metric (unit) (0.64),"Green analytical chemistry focuses on making analytical procedures more environmentally benign and safer to humans. The amounts and toxicity of reagents, generated waste, energy requirements, the number of procedural steps, miniaturization, and automation are just a few of the multitude of criteria ...",Analytical Chemistry
operating systems,2020,13,https://openalex.org/W3046751266,Scalable molecular dynamics on CPU and GPU architectures with NAMD,J. C. Phillips; David J. Hardy; Julio D. C. Maia,Computer science (0.66); Scalability (0.63); Molecular dynamics (0.54),"NAMDis a molecular dynamics program designed for high-performance simulations of very large biological objects on CPU- and GPU-based architectures. NAMD offers scalable performance on petascale parallel supercomputers consisting of hundreds of thousands of cores, as well as on inexpensive commodity ...",The Journal of Chemical Physics
operating systems,2020,14,https://openalex.org/W2998175747,International evaluation of an AI system for breast cancer screening,Scott Mayer McKinney; Marcin Sieniek; Varun Godbole,False positive paradox (0.81); Breast cancer (0.65); Mammography (0.65),,Nature
operating systems,2020,15,https://openalex.org/W3047141442,Generalizing RNA velocity to transient cell states through dynamical modeling,Volker Bergen; Marius Lange; Stefan Peidli,Transient (computer programming) (0.71); RNA (0.49); Computational biology (0.37),,Nature Biotechnology
operating systems,2020,16,https://openalex.org/W3002362821,Identifying and removing haplotypic duplication in primary genome assemblies,Dengfeng Guan; Shane McCarthy; Jonathan Wood,Computer science (0.68); Purge (0.67); Source code (0.55),Supplementary data are available at Bioinformatics online.,Bioinformatics
operating systems,2020,17,https://openalex.org/W3043135743,Reporting animal research: Explanation and elaboration for the ARRIVE guidelines 2.0,Nathalie Percie du Sert; Amrita Ahluwalia; Sabina Alam,Elaboration (0.84); Transparency (behavior) (0.68); Process (computing) (0.54),Improving the reproducibility of biomedical research is a major challenge. Transparent and accurate reporting is vital to this process; it allows readers to assess the reliability of the findings and repeat or build upon the work of other researchers. The ARRIVE guidelines (Animal Research: Reportin...,PLoS Biology
operating systems,2020,18,https://openalex.org/W3013215798,Quantifying SARS-CoV-2 transmission suggests epidemic control with digital contact tracing,Luca Ferretti; Chris Wymant; Michelle Kendall,Contact tracing (0.95); Transmission (telecommunications) (0.70); Epidemic control (0.62),The newly emergent human virus SARS-CoV-2 (severe acute respiratory syndrome-coronavirus 2) is resulting in high fatality rates and incapacitated health systems. Preventing further transmission is a priority. We analyzed key parameters of epidemic spread to estimate the contribution of different tra...,Science
operating systems,2020,19,https://openalex.org/W3015788359,UNet 3+: A Full-Scale Connected UNet for Medical Image Segmentation,Huimin Huang; Lanfen Lin; Ruofeng Tong,Computer science (0.81); Segmentation (0.79); Artificial intelligence (0.62),"Recently, a growing interest has been seen in deep learning-based semantic segmentation. UNet, which is one of deep learning networks with an encoder-decoder architecture, is widely used in medical image segmentation. Combining multi-scale features is one of important factors for accurate segmentati...",
operating systems,2020,20,https://openalex.org/W3034942609,Generalizing from a Few Examples,Yaqing Wang; Quanming Yao; James T. Kwok,Computer science (0.85); Categorization (0.65); Machine learning (0.60),"Machine learning has been highly successful in data-intensive applications but is often hampered when the data set is small. Recently, Few-shot Learning (FSL) is proposed to tackle this problem. Using prior knowledge, FSL can rapidly generalize to new tasks containing only a few samples with supervi...",ACM Computing Surveys
operating systems,2020,21,https://openalex.org/W3012094285,GenomeScope 2.0 and Smudgeplot for reference-free profiling of polyploid genomes,T. Rhyker Ranallo-Benavidez; Kamil S. Jaroň; Michael C. Schatz,Polyploid (0.85); Genome (0.85); Ploidy (0.62),"An important assessment prior to genome assembly and related analyses is genome profiling, where the k-mer frequencies within raw sequencing reads are analyzed to estimate major genome characteristics such as size, heterozygosity, and repetitiveness. Here we introduce GenomeScope 2.0 (https://github...",Nature Communications
operating systems,2020,22,https://openalex.org/W3007075333,BlobToolKit – Interactive Quality Assessment of Genome Assemblies,Richard Challis; E. G. Richards; Jeena Rajan,Genome (0.62); Computer science (0.57); Pipeline (software) (0.51),"Reconstruction of target genomes from sequence data produced by instruments that are agnostic as to the species-of-origin may be confounded by contaminant DNA. Whether introduced during sample processing or through co-extraction alongside the target DNA, if insufficient care is taken during the asse...",G3 Genes Genomes Genetics
operating systems,2020,23,https://openalex.org/W3085749548,Online teaching-learning in higher education during lockdown period of COVID-19 pandemic,Lokanath Mishra; Tushar Gupta; Abha Shree,Pandemic (0.54); Globe (0.48); Mathematics education (0.47),The whole educational system from elementary to tertiary level has been collapsed during the lockdown period of the novel coronavirus disease 2019 (COVID-19) not only in India but across the globe. This study is a portrayal of online teaching-learning modes adopted by the Mizoram University for the ...,International Journal of Educational Research Open
operating systems,2020,24,https://openalex.org/W3035423599,The art of writing literature review: What do we know and what do we need to know?,Justin Paul; Alex Rialp,Systematic review (0.69); Foundation (evidence) (0.57); Theme (computing) (0.56),,International Business Review
operating systems,2020,25,https://openalex.org/W3035160371,Self-Training With Noisy Student Improves ImageNet Classification,Qizhe Xie; Minh-Thang Luong; Eduard Hovy,Robustness (evolution) (0.80); Computer science (0.70); Artificial intelligence (0.58),"We present a simple self-training method that achieves 88.4% top-1 accuracy on ImageNet, which is 2.0% better than the state-of-the-art model that requires 3.5B weakly labeled Instagram images. On robustness test sets, it improves ImageNet-A top-1 accuracy from 61.0% to 83.7%, reduces ImageNet-C mea...",
operating systems,2020,26,https://openalex.org/W3006234984,Automated exploration of the low-energy chemical space with fast quantum chemical methods,Philipp Pracht; Fabian Bohle; Stefan Grimme,Chemical space (0.82); Quantum chemical (0.81); Space (punctuation) (0.63),We propose and discuss an efficient scheme for the in silico sampling for parts of the molecular chemical space by semiempirical tight-binding methods combined with a meta-dynamics driven search algorithm. The focus of this work is set on the generation of proper thermodynamic ensembles at a quantum...,Physical Chemistry Chemical Physics
operating systems,2020,27,https://openalex.org/W3015468748,Longformer: The Long-Document Transformer,Iz Beltagy; Matthew E. Peters; Arman Cohan,Automatic summarization (0.83); Transformer (0.82); Computer science (0.77),"Transformer-based models are unable to process long sequences due to their self-attention operation, which scales quadratically with the sequence length. To address this limitation, we introduce the Longformer with an attention mechanism that scales linearly with sequence length, making it easy to p...",arXiv (Cornell University)
operating systems,2020,28,https://openalex.org/W3035396860,Bridging the Gap Between Anchor-Based and Anchor-Free Detection via Adaptive Training Sample Selection,Shifeng Zhang; Cheng Chi; Yongqiang Yao,Detector (0.77); Computer science (0.76); Bridging (networking) (0.71),"Object detection has been dominated by anchor-based detectors for several years. Recently, anchor-free detectors have become popular due to the proposal of FPN and Focal Loss. In this paper, we first point out that the essential difference between anchor-based and anchor-free detection is actually h...",
operating systems,2020,29,https://openalex.org/W3034933627,"Adsorption isotherm models: Classification, physical meaning, application and solving method",Jianlong Wang; Xuan Guo,Adsorption (0.90); Thermodynamics (0.60); Sorption isotherm (0.57),,Chemosphere
operating systems,2020,30,https://openalex.org/W3003821665,Fully hardware-implemented memristor convolutional neural network,Peng Yao; Huaqiang Wu; Bin Gao,Memristor (0.92); Neuromorphic engineering (0.82); Computer science (0.76),,Nature
operating systems,2020,31,https://openalex.org/W3012041784,Characterising the Digital Twin: A systematic literature review,David Jones; Chris Snider; Aydin Nassehi,Terminology (0.69); Computer science (0.52); Data science (0.45),"While there has been a recent growth of interest in the Digital Twin, a variety of definitions employed across industry and academia remain. There is a need to consolidate research such to maintain a common understanding of the topic and ensure future research efforts are to be based on solid founda...",CIRP journal of manufacturing science and technology
operating systems,2020,32,https://openalex.org/W3011830499,Toward 6G Networks: Use Cases and Technologies,Marco Giordani; Michele Polese; Marco Mezzavilla,Computer science (0.83); Wireless (0.57); Cloud computing (0.55),"Reliable data connectivity is vital for the ever increasingly intelligent, automated, and ubiquitous digital world. Mobile networks are the data highways and, in a fully connected, intelligent digital world, will need to connect everything, including people to vehicles, sensors, data, cloud resource...",IEEE Communications Magazine
operating systems,2020,33,https://openalex.org/W3013080934,Memory devices and applications for in-memory computing,Abu Sebastian; Manuel Le Gallo; Riduan Khaddam-Aljameh,In-Memory Processing (0.82); Computer science (0.81); Von Neumann architecture (0.73),,Nature Nanotechnology
operating systems,2020,34,https://openalex.org/W3007268491,ResUNet-a: A deep learning framework for semantic segmentation of remotely sensed data,Foivos I. Diakogiannis; François Waldner; Peter Caccetta,Computer science (0.81); Segmentation (0.77); Artificial intelligence (0.70),,ISPRS Journal of Photogrammetry and Remote Sensing
operating systems,2020,35,https://openalex.org/W3016932526,Q<scp>uantum</scp> ESPRESSO toward the exascale,Paolo Giannozzi; Oscar Baseggio; Pietro Bonfà,Exascale computing (0.71); Computer science (0.63); Massively parallel (0.62),"Quantum ESPRESSO is an open-source distribution of computer codes for quantum-mechanical materials modeling, based on density-functional theory, pseudopotentials, and plane waves, and renowned for its performance on a wide range of hardware architectures, from laptops to massively parallel computers...",The Journal of Chemical Physics
operating systems,2020,36,https://openalex.org/W2999175750,"Using MicrobiomeAnalyst for comprehensive statistical, functional, and meta-analysis of microbiome data",Jasmine Chong; Peng Liu; Guangyan Zhou,Profiling (computer programming) (0.77); Computer science (0.72); Microbiome (0.70),,Nature Protocols
operating systems,2020,37,https://openalex.org/W2964383261,The Rise of Market Power and the Macroeconomic Implications*,Jan De Loecker; Jan Eeckhout; Gabriel Unger,Economics (0.80); Market power (0.66); Dynamism (0.59),"Abstract We document the evolution of market power based on firm-level data for the U.S. economy since 1955. We measure both markups and profitability. In 1980, aggregate markups start to rise from 21% above marginal cost to 61% now. The increase is driven mainly by the upper tail of the markup dist...",The Quarterly Journal of Economics
operating systems,2020,38,https://openalex.org/W2998500935,Causes of Higher Climate Sensitivity in CMIP6 Models,Mark D. Zelinka; Timothy A. Myers; Daniel T. McCoy,Coupled model intercomparison project (0.80); Extratropical cyclone (0.78); Climate sensitivity (0.77),"Abstract Equilibrium climate sensitivity, the global surface temperature response to CO doubling, has been persistently uncertain. Recent consensus places it likely within 1.5–4.5 K. Global climate models (GCMs), which attempt to represent all relevant physical processes, provide the most direct mea...",Geophysical Research Letters
operating systems,2020,39,https://openalex.org/W3015438624,The HDOCK server for integrated protein–protein docking,Yumeng Yan; Huanyu Tao; Jiahua He,Docking (animal) (0.91); Macromolecular docking (0.68); Protein–ligand docking (0.66),,Nature Protocols
operating systems,2020,40,https://openalex.org/W1975534106,Geographic Information Systems,,Geographic information system (0.73); Computer science (0.64); GIS and public health (0.57),"The chapter presents the geographic information systems. A geographic information system (GIS) is a computer system that allows various sources to gather and organize, manage, analyze and combine, develop, and present geographically located information contributing in particular to the management fr...",Advances in public policy and administration (APPA) book series
operating systems,2020,41,https://openalex.org/W3001554335,"Scopus as a curated, high-quality bibliometric data source for academic research in quantitative science studies",Jeroen Baas; Michiel Schotten; Andrew Plume,Scopus (0.92); Bibliometrics (0.59); Metadata (0.59),"Scopus is among the largest curated abstract and citation databases, with a wide global and regional coverage of scientific journals, conference proceedings, and books, while ensuring only the highest quality data are indexed through rigorous content selection and re-evaluation by an independent Con...",Quantitative Science Studies
operating systems,2020,42,https://openalex.org/W3012846954,Profiling Early Humoral Response to Diagnose Novel Coronavirus Disease (COVID-19),Li Guo; Lili Ren; Siyuan Yang,Coronavirus disease 2019 (COVID-19) (0.81); Profiling (computer programming) (0.64); 2019-20 coronavirus outbreak (0.64),"The humoral response to SARS-CoV-2 can aid in the diagnosis of COVID-19, including subclinical cases.",Clinical Infectious Diseases
operating systems,2020,43,https://openalex.org/W3109793392,Fibrosis: from mechanisms to medicines,Neil C. Henderson; Florian Rieder; Thomas A. Wynn,Fibrosis (0.67); Translational research (0.49); Transformative learning (0.48),,Nature
operating systems,2020,44,https://openalex.org/W3041494167,Deep immune profiling of COVID-19 patients reveals distinct immunotypes with therapeutic implications,Divij Mathew; Josephine R. Giles; Amy E. Baxter,Coronavirus disease 2019 (COVID-19) (0.79); Profiling (computer programming) (0.66); Severe acute respiratory syndrome coronavirus 2 (SARS-CoV-2) (0.64),"Immune profiling of COVID-19 patients Coronavirus disease 2019 (COVID-19) has affected millions of people globally, yet how the human immune system responds to and influences COVID-19 severity remains unclear. Mathew et al. present a comprehensive atlas of immune modulation associated with COVID-19....",Science
operating systems,2020,45,https://openalex.org/W3003667836,"Digital Twin: Values, Challenges and Enablers From a Modeling Perspective",Adil Rasheed; Omer San; Trond Kvamsdal,Computer science (0.76); Data science (0.55); Big data (0.53),"Digital twin can be defined as a virtual representation of a physical asset enabled through data and simulators for real-time prediction, optimization, monitoring, controlling, and improved decision making. Recent advances in computational pipelines, multiphysics solvers, artificial intelligence, bi...",IEEE Access
operating systems,2020,46,https://openalex.org/W3015163167,CINeMA: An approach for assessing confidence in the results of a network meta-analysis,Adriani Nikolakopoulou; Julian P. T. Higgins; Theodoros Papakonstantinou,Meta-analysis (0.72); Movie theater (0.67); Credibility (0.64),"Via 3 examples, we show that CINeMA improves transparency and avoids the selective use of evidence when forming judgments, thus limiting subjectivity in the process. CINeMA is easy to apply even in large and complicated networks.",PLoS Medicine
operating systems,2020,47,https://openalex.org/W3092664098,ASAP: assemble species by automatic partitioning,Nicolas Puillandre; Sophie Brouillet; Guillaume Achaz,Coalescent theory (0.76); Barcode (0.73); Biology (0.65),"Here, we describe Assemble Species by Automatic Partitioning (ASAP), a new method to build species partitions from single locus sequence alignments (i.e., barcode data sets). ASAP is efficient enough to split data sets as large 10<sup>4</sup> sequences into putative species in several minutes. Altho...",Molecular Ecology Resources
operating systems,2020,48,https://openalex.org/W2997848713,GMAN: A Graph Multi-Attention Network for Traffic Prediction,Chuanpan Zheng; Xiaoliang Fan; Cheng Wang,Computer science (0.81); Encoder (0.76); Graph (0.55),"Long-term traffic prediction is highly challenging due to the complexity of traffic systems and the constantly changing nature of many impacting factors. In this paper, we focus on the spatio-temporal factors, and propose a graph multi-attention network (GMAN) to predict traffic conditions for time ...",Proceedings of the AAAI Conference on Artificial Intelligence
operating systems,2020,49,https://openalex.org/W3034713808,Celeb-DF: A Large-Scale Challenging Dataset for DeepFake Forensics,Yuezun Li; Xin Yang; Pu Sun,Computer science (0.80); Trustworthiness (0.69); Scale (ratio) (0.60),"AI-synthesized face-swapping videos, commonly known as DeepFakes, is an emerging problem threatening the trustworthiness of online information. The need to develop and evaluate DeepFake detection algorithms calls for datasets of DeepFake videos. However, current DeepFake datasets suffer from low vis...",
operating systems,2020,50,https://openalex.org/W3081879483,The contribution of global aviation to anthropogenic climate forcing for 2000 to 2018,David S. Lee; D. W. Fahey; Agnieszka Skowron,Radiative forcing (0.86); Cirrus (0.82); Environmental science (0.70),"Global aviation operations contribute to anthropogenic climate change via a complex set of processes that lead to a net surface warming. Of importance are aviation emissions of carbon dioxide (CO<sub>2</sub>), nitrogen oxides (NO<sub>x</sub>), water vapor, soot and sulfate aerosols, and increased cl...",Atmospheric Environment
compilers,1975,1,https://openalex.org/W2166780994,The programming language Concurrent Pascal,Per Brinch Hansen,Computer science (0.89); Programming language (0.85); Pascal (unit) (0.73),Describes a new programming language for structured programming of computer operating systems. It extends the sequential programming language Pascal with concurrent programming tools called processes and monitors. Section I explains these concepts informally by means of pictures illustrating a hiera...,IEEE Transactions on Software Engineering
compilers,1975,2,https://openalex.org/W2118252041,Programming-in-the large versus programming-in-the-small,Frank DeRemer; Hans H. Kron,Computer science (0.91); Programming language (0.78); Compiler (0.74),"We distinguish the activity of writing large programs from that of writing small ones. By large programs we mean systems consisting of many small programs (modules), possibly written by different people. We need languages for programming-in-the-small, i.e. languages not unlike the common programming...",ACM SIGPLAN Notices
compilers,1975,3,https://openalex.org/W1995258570,Iterative enhancement: A practical technique for software development,Victor R. Basil; Albert J. Turner,Computer science (0.85); Compiler (0.67); Implementation (0.57),"This paper recommends the iterative enhancement' technique as a practical means of using a top-down, stepwise refinement approach to software development. This technique begins with a simple initial implementation of a property chosen (skeletal) subproject which is followed by the gradual enhancemen...",IEEE Transactions on Software Engineering
compilers,1975,4,https://openalex.org/W1510165340,Programming Languages: Design and Implementation,Terrence W. Pratt,Programming language (0.88); Computer science (0.82); Compiler (0.57),"From the Publisher:
Exceptionally comprehensive in approach, this book explores the major issues in both design and implementation of modern programming languages and provides a basic introduction to the underlying theoretical models on which these languages are based. The emphasis throughout is on...",CERN Document Server (European Organization for Nuclear Research)
compilers,1975,5,https://openalex.org/W2056304107,Complete Register Allocation Problems,Ravi Sethi,Register allocation (0.94); Computer science (0.75); Compiler (0.66),"The search for efficient register allocation algorithms dates back to the time of the first FORTRAN compiler for the IBM 704. The model we use in this paper is a single processor with an arbitrarily large number of general registers. The objective is to use as few registers as possible, under the,co...",SIAM Journal on Computing
compilers,1975,6,https://openalex.org/W2145343598,INGRES,Gerald Held; Michael Stonebraker; Eugene Wong,Unix (0.90); Computer science (0.86); Unix architecture (0.76),INGRES (Interactive Graphics and Retrieval System) is a relational data base and graphics system which is being implemented on a PDP-11/40 based hardware configuration at Berkeley. INGRES runs as a normal user job on top of the UNIX operating system developed at the Bell Telephone Laboratories. The ...,
compilers,1975,7,https://openalex.org/W2063013240,A system for typesetting mathematics,Brian W. Kernighan; Lorinda L. Cherry,Compiler (0.83); Computer science (0.82); Programming language (0.69),"This paper describes the design and implementation of a system for typesetting mathematics. The language has been designed to be easy to learn and to use by people (for example, secretaries and mathematical typists) who know neither mathematics nor typesetting. Experience indicates that the language...",Communications of the ACM
compilers,1975,8,https://openalex.org/W2143560013,Short titles of Old English texts,Bruce Mitchell; Christopher Ball; Angus Cameron,Old English (0.70); Poetry (0.66); Syntax (0.62),"This is the list referred to by Helmut Gneuss in his ‘Guide to the Editing and Preparation of Texts for the Dictionary of Old English’, A. Plan for the Dictionary of Old English , ed. R. Frank and A. Cameron (Toronto, 1973), pp. 9–23. The list has been prepared for use in The Dictionary of Old Engli...",Anglo-Saxon England
compilers,1975,9,https://openalex.org/W2090738136,Alternating semantic evaluator,Mehdi Jazayeri; Kenneth G. Walter,L-attributed grammar (0.88); Computer science (0.82); Programming language (0.79),"In order to make the use of attribute grammars practical in (automatic) compiler generation, restricted attribute grammars are introduced. A membership test is given which determines whether a given attribute grammar satisfies the required restrictions. The major advantage of the restricted attribut...",
