subfield,year,rank,work_id,title,authors_top3,concepts_top3,abstract_preview,primary_source
compilers,1975,10,https://openalex.org/W2003008491,Step‐Drawdown Test Analysis by Computer,John W. Labadie; Otto J. Helweg,Fortran (0.83); Drawdown (hydrology) (0.82); Listing (finance) (0.76),"ABSTRACT Many geohydrologists believe that the step‐drawdown test is useful in determining many important characteristics of a well, whereas others altogether question its utility. In addition to this controversy, its application is hindered because the graphical analysis of data is unwieldy. A comp...",Ground Water
compilers,1975,11,https://openalex.org/W2047053144,Computer time and memory requirements for DP and DDDP in water resource systems analysis,Ven Te Chow; David R. Maidment; George W. Tauxe,Computer science (0.69); Computer memory (0.62); Memory address (0.56),"The computer time required for a water resource optimization problem by dynamic programing (DP) or discrete differential dynamic programing (DDDP) may be considered as the sum of the compiling time for programing language translation, the initiating time for the program, and the execution time T E ....",Water Resources Research
compilers,1975,12,https://openalex.org/W1990364537,Nuclear data sheets for A = 65,R.L. Auble,Nuclear data (0.86); Data file (0.69); Computer science (0.67),,Nuclear Data Sheets
compilers,1975,13,https://openalex.org/W1580627069,Mathematical semantics and compiler generation,Peter D. Mosses,Compiler (0.74); Programming language (0.72); Computer science (0.67),"The method of giving the mathematical (or denotational) semantics of a programming language, as developed by Dana Scott and Christopher Strachey, is taken as a starting-point.The main work is towards a general and portable compiler-generator system, which generates a compiler for any programming lan...",Oxford University Research Archive (ORA) (University of Oxford)
compilers,1975,14,https://openalex.org/W4298295268,The Programming Language Concurrent Pascal,Per Brinch Hansen,Programming language (0.85); Computer science (0.84); Pascal (unit) (0.78),,
compilers,1975,15,https://openalex.org/W2074830943,Fortran for the Texas Instruments ASC system,Dorothy Wedel,Fortran (0.91); Compiler (0.88); Computer science (0.81),The ASC Fortran compiler and the methods of optimizing the execution times of compiled programs are described. Language extensions and compiler organization are briefly outlined. Traditional scalar optimization techniques and techniques to detect and generate vector operations from ANS standard Fort...,ACM SIGPLAN Notices
compilers,1975,16,https://openalex.org/W2082833978,Nuclear data sheets for A = 67,R.L. Auble,Nuclear data (0.84); Computer science (0.69); Data file (0.64),,Nuclear Data Sheets
compilers,1975,17,https://openalex.org/W1603358947,Syntax-Directed Description of Incremental Compilers,Hans Jürgen Schneider,Computer science (0.86); Compiler (0.75); Programming language (0.74),,Lecture notes in computer science
compilers,1975,18,https://openalex.org/W2079156168,Nuclear data sheets for A = 79,Paul Peter Urone; D.C. Kocher,Physics (0.66); Excited state (0.64); Ground state (0.56),,Nuclear Data Sheets
compilers,1975,19,https://openalex.org/W1980890556,Nuclear Data Sheets for A = 75,D. J. Horen; M.B. Lewis,Nuclear data (0.89); Data file (0.61); Computer science (0.58),,Nuclear Data Sheets
compilers,1975,20,https://openalex.org/W2001415073,Nuclear data sheets for A = 66,R.L. Auble,Nuclear data (0.84); Computer science (0.66); Data file (0.66),,Nuclear Data Sheets
compilers,1975,21,https://openalex.org/W2080324741,A transportable extendable compiler,Victor R. Basili; Albert J. Turner,Compiler (0.93); Computer science (0.80); Programming language (0.74),"Abstract This report describes the development of a transportable extendable self‐compiler for the language SIMPL‐T. SIMPL‐T is designed as the base language for a family of languages. The structure of the SIMPL‐T compiler and its transportable bootstrap are described. In addition, the procedures fo...",Software Practice and Experience
compilers,1975,22,https://openalex.org/W1499708355,An Approach to Global Register Allocation,Richard K. Johnsson,Register allocation (0.84); Register (sociolinguistics) (0.82); Computer science (0.47),Abstract : The thesis presents an approach to the problem of global register allocation as performed by an optimizing compiler. The problem considered is actually the more general one of choosing what physical resource within the target machine will be used to hold the results of various computation...,
compilers,1975,23,https://openalex.org/W2047911974,The Paralyzer,David Presberg,Computer science (0.91); Compiler (0.76); Parallel computing (0.74),"The ILLIAC IV Fortran compiler's Parallelism Analyzer and Synthesizer (mnemonicized as the Paralyzer) detects computations in Fortran DO loops which can be performed in parallel. It is a step of the compiling process which lies between source language parsing and target code generation, and as such ...",ACM SIGPLAN Notices
compilers,1975,24,https://openalex.org/W2167730184,Application of the optimization program AOP to the design of memory circuits,Gary D. Hachtel; Michael Lightner; H. P. Kelly,Computer science (0.78); Computation (0.50); Sensitivity (control systems) (0.49),"The memory cycle time of an IGFET read-only memory cell is designed using AOP, a program for automated and interactive optimization of electrical networks. It is shown how AOP allows the user to specify multiple performance objectives and to request analysis, and/or adjoint sensitivity computation, ...",IEEE Transactions on Circuits and Systems
compilers,1975,25,https://openalex.org/W2027649264,The Influence of the Compiler on the Cost of Mathematical Software—in Particular on the Cost of Triangular Factorization,Beresford Ν. Parlett; Y. Wang,Citation (0.82); Compiler (0.81); Computer science (0.73),"article The Influence of the Compiler on the Cost of Mathematical Software—in Particular on the Cost of Triangular Factorization Share on Authors: B. N. Parlett Computer Science Division, University of California, Berkeley CA Computer Science Division, University of California, Berkeley CAView Profi...",ACM Transactions on Mathematical Software
compilers,1975,26,https://openalex.org/W2090276525,The ILLIAC IV FORTRAN compiler,Robert E. Millstein; Charles A. Muntz,Fortran (0.90); Computer science (0.87); Programming language (0.80),This paper provides a basic description of a FORTRAN system for the ILLIAC IV. In this context “FORTRAN system” means exactly what one would expect — a user familiar with a different system will find no major surprises when he uses ILLIAC FORTRAN. The language is the same — a dialect of ANSI standar...,ACM SIGPLAN Notices
compilers,1975,27,https://openalex.org/W1986451646,A parallel approach to code generation for Fortran like compilers,Howard E. Krohn,Computer science (0.87); Fortran (0.78); Programming language (0.76),It has been shown by Lincoln and others that vector operations can be used to perform lexical analysis of FORTRAN source code. This paper presents techniques for code generation using parallel programming methods developed on the CDC STAR-100. Methods are presented for handling arithmetic assignment...,ACM SIGPLAN Notices
compilers,1975,28,https://openalex.org/W1982910157,Program optimization - theory and practice,David B. Loveman; Ross A. Faneuf,Computer science (0.86); Fortran (0.77); Compiler (0.72),"The conventional program optimization techniques employed by the ILLIAC FORTRAN compiler are general purpose, effective, and efficient. The underlying theory is applicable to FORTRAN and to other high level languages. A unique approach to the gathering of global set and use information about variabl...",ACM SIGPLAN Notices
compilers,1975,29,https://openalex.org/W1578467903,A Portable Compiler for the Language C,Alan Snyder,Computer science (0.86); Compiler (0.78); Machine code (0.78),This paper describes the implementation of a compiler for the language C. The compiler has been designed to be able to be capable of producing assembly-language code for most register-oriented machines with only minor recoding.,
compilers,1975,30,https://openalex.org/W2012910134,On the need for fewer restrictions in changing compile-time environments,David Lorge Parnas; John E. Shore; W. David Elliott,Computer science (0.90); Compiler (0.85); Compile time (0.79),"Compilers for current programming languages enforce rigid restrictions on changes, during the compilation of a statement, in the set of associations between names and declarations, that is, on changes in the compile-time environment of the statement. These restrictions inhibit the writing of well-st...",ACM SIGPLAN Notices
compilers,1975,31,https://openalex.org/W1557486623,Machine-independent generation of optimal local code.,Joseph M. Newcomer,Programming language (0.83); Computer science (0.82); Compiler (0.82),"Abstract : There has been extensive research into the automatic generation of compilers. Much of this has concentrated on the issues of syntax and semantics, while little has been done on the problems of code generation. This thesis represents one approach to the latter problem. A model of a compile...",
compilers,1975,32,https://openalex.org/W2057141553,Lexical analysis and parsing techniques for a vector machine,Michael K. Donegan; Stuart W. Kartzke,Computer science (0.91); Parsing (0.79); Compiler (0.68),The use of vector oriented hardware for compilation places a special burden on the compiler writer to make use of vector operations whenever possible. This paper presents various techniques for lexical analysis and parsing using the CDC STAR-100 instruction set. Although the similarity between APL a...,ACM SIGPLAN Notices
compilers,1975,33,https://openalex.org/W2073896195,An approach to compiler correctness,Laurian M. Chirica; David F. Martin,Computer science (0.90); Correctness (0.86); Compiler (0.82),"This paper is a preliminary report on an experiment in applying Floyd's method of inductive assertions to the compiler correctness problem. Practical postfix translators are considered, and the semantics of source and object languages are characterized by Floyd verification conditions. Compiler corr...",ACM SIGPLAN Notices
compilers,1975,34,https://openalex.org/W2015990401,Vector extensions to LRLTRAN,Richard G. Zwakenberg,Computer science (0.91); Programming language (0.74); Operand (0.68),The CDC STAR-100 brings a new concept in computing to LLL. The STAR is a string(vector) - oriented machine that is most efficient when it performs the same operations on sequentially stored operands. This approach to computer design opens up new areas of problem-solving techniques. Some algorithms t...,ACM SIGPLAN Notices
compilers,1975,35,https://openalex.org/W1981392712,The purpose of concurrent Pascal,Per Brinch Hansen,Pascal (unit) (0.90); Computer science (0.85); Programming language (0.79),"This is the first of three papers that describe a new programming language for structured programming of computer operating systems [1, 2, 3]. It extends the sequential programming language Pascal with concurrent programming tools called processes and monitors. These concepts are explained informall...",ACM SIGPLAN Notices
compilers,1975,36,https://openalex.org/W2011042950,Proving a compiler correct: A simple approach,G. Germano; A. Maggiolo‐Schettini,Compiler (0.81); Computer science (0.80); Programming language (0.75),,Journal of Computer and System Sciences
compilers,1975,37,https://openalex.org/W294272257,Architecture of Stack Machines,Robert W. Doran,Computer science (0.77); Stack (abstract data type) (0.76); Call stack (0.74),,Elsevier eBooks
compilers,1975,38,https://openalex.org/W1986652849,Removal of invariant statements from nested-loops in a single effective compiler pass,D. Neel; M. Amirchahy,Computer science (0.88); Compiler (0.80); Invariant (physics) (0.59),This document presents how one of the most important optimizations that a program may undergo is dealt with by means of attributes [7]. A semantic formalization of the classical method which consists of removing all loop-independent statements from the articulation blocks of a loop is given. The met...,ACM SIGPLAN Notices
compilers,1975,39,https://openalex.org/W1495679304,Conceptual Design of a Direct High-Level Language Processor,Howard Bloom,Computer science (0.83); Programmer (0.73); Programming language (0.71),,Elsevier eBooks
compilers,1975,40,https://openalex.org/W893476689,FILES: Automated Engineering Data Management System,Leonard A. Lopez,Computer science (0.78); Compiler (0.69); Data management (0.58),One approach to engineering data base management has been presented herein. The problem is a complex one and has no apparent correct or incorrect solution. Various techniques have been tried by other investigators. Each generation brings new ideas and hopefully better approaches to engineering data ...,Journal of the Structural Division
compilers,1975,41,https://openalex.org/W630731827,An introduction to compiler writing,J. S. Rohl,Compiler (0.72); Computer science (0.62); Programming language (0.59),,
compilers,1975,42,https://openalex.org/W2010102173,Biomac: Block structured programming using PDP‐11 assembler language,G. S. Herman‐Giddens; Robert Warren; R. C. Barr,Macro (0.91); Computer science (0.84); Subroutine (0.75),Abstract Users of small computers must often program in assembler language. Macros are described which assist in the construction of block structured programs in assembler language. The macros are used in practical day‐to‐day programming in a cardiac electrophysiology laboratory in which the coarse ...,Software Practice and Experience
compilers,1975,43,https://openalex.org/W4245202685,Syntax-directed description of incremental compilers,Hans Jürgen Schneider,Computer science (0.92); Programming language (0.83); Compiler (0.75),,Lecture notes in computer science
compilers,1975,44,https://openalex.org/W107200132,The SIMPL Family of Programming Languages and Compilers.,Victor R. Basili,Programming language (0.77); Computer science (0.74); Compiler (0.70),,Workshop on Graph-Theoretic Concepts in Computer Science
compilers,1975,45,https://openalex.org/W2028553829,A language design for vector machines,Victor R. Basili; John Knight,Computer science (0.79); Compiler (0.76); Programming language (0.64),"This paper deals with a programming language under development at NASA's Langley Research Center for the CDC STAR-100. The design goals for the language are that it be basic in design and able to be extended as deemed necessary to serve the user community, capable of the expression of efficient algo...",ACM SIGPLAN Notices
compilers,1975,46,https://openalex.org/W2615950992,Lexical analysis and parsing techniques for a vector machine,Michael K. Donegan; Stuart W. Kartzke,Computer science (0.85); Parsing (0.83); Compiler (0.70),The use of vector oriented hardware for compilation places a special burden on the compiler writer to make use of vector operations whenever possible. This paper presents various techniques for lexical analysis and parsing using the CDC STAR-100 instruction set. Although the similarity between APL a...,
compilers,1975,47,https://openalex.org/W4231813175,PATIWEN— a code for coulomb-nuclear interference calculations,Da Hsuan Feng; A.R. Barnett,Fortran (0.81); Compiler (0.78); Computer science (0.74),,Computer Physics Communications
compilers,1975,48,https://openalex.org/W2053153504,A theorem about automatic programming,Peter Kugel,Computer science (0.77); Debugging (0.76); Programming language (0.72),"An automatic programming system is a system (usually a programmed computer) that generates a program from partial information about that program (Figure 1). Looked at in this general way, automatic programming systems are hardly new. Assemblers are automatic programming systems. So are compilers, de...",ACM SIGART Bulletin
compilers,1975,49,https://openalex.org/W1510752621,Parsing as a subtask of compiling,Jaroslav Král; Jiří Demner,Computer science (0.89); Parsing (0.86); Programming language (0.57),,Lecture notes in computer science
compilers,1975,50,https://openalex.org/W1966759408,Building a programming language for a small computer: Reinventing the wheel,Gordon F. Pitz,Computer science (0.84); Programming language (0.84); Interpreter (0.83),,Behavior Research Methods
compilers,2020,1,https://openalex.org/W1536051636,Optimizing supercompilers for supercomputers,Michael Wolfe,Compiler (0.91); Computer science (0.90); Software portability (0.85),"Between a problem statement and its solution as a computer simulation are several steps, from choosing a method, writing a program, compiling to machine code, making runtime decisions, and hardware execution. Here we will look at the middle three decision points. What decisions should be and must be...",
compilers,2020,2,https://openalex.org/W3013348036,t|ket⟩: a retargetable compiler for NISQ devices,Seyon Sivarajah; Silas Dilkes; Alexander Cowtan,Compiler (0.86); Computer science (0.85); Optimizing compiler (0.54),"Abstract We present t | ket ⟩, a quantum software development platform produced by Cambridge Quantum Computing Ltd. The heart of t | ket ⟩ is a language-agnostic optimising compiler designed to generate code for a variety of NISQ devices, which has several features designed to minimise the influence...",Quantum Science and Technology
compilers,2020,3,https://openalex.org/W3104914200,t|ket> : A retargetable compiler for NISQ devices,Seyon Sivarajah; Silas Dilkes; Alexander Cowtan,Compiler (0.93); Computer science (0.82); Software (0.53),"We present t|ket>, a quantum software development platform produced by Cambridge Quantum Computing Ltd. The heart of t|ket> is a language-agnostic optimising compiler designed to generate code for a variety of NISQ devices, which has several features designed to minimise the influence of device erro...",Strathprints: The University of Strathclyde institutional repository (University of Strathclyde)
compilers,2020,4,https://openalex.org/W3040573126,GShard: Scaling Giant Models with Conditional Computation and Automatic Sharding,Dmitry Lepikhin; HyoukJoong Lee; Yuanzhong Xu,Computer science (0.84); Computation (0.67); Compiler (0.63),"Neural network scaling has been critical for improving the model quality in many real-world machine learning applications with vast amounts of training data and compute. Although this trend of scaling is affirmed to be a sure-fire approach for better model quality, there are challenges on the path s...",arXiv (Cornell University)
compilers,2020,5,https://openalex.org/W3011196476,Fast Packet Processing with eBPF and XDP,Marcos A. M. Vieira; Matheus S. Castanho; Racyus D. G. Pacífico,Computer science (0.92); Linux kernel (0.66); Packet processing (0.66),"Extended Berkeley Packet Filter (eBPF) is an instruction set and an execution environment inside the Linux kernel. It enables modification, interaction, and kernel programmability at runtime. eBPF can be used to program the eXpress Data Path (XDP), a kernel network layer that processes packets close...",ACM Computing Surveys
compilers,2020,6,https://openalex.org/W2990120385,Transparent SNARKs from DARK Compilers,Benedikt Bünz; Ben Fisch; Alan Szepieniec,Computer science (0.74); Gas meter prover (0.65); Compiler (0.57),,Lecture notes in computer science
compilers,2020,7,https://openalex.org/W3015844221,LVI: Hijacking Transient Execution through Microarchitectural Load Value Injection,Jo Van Bulck; Daniel Moghimi; Michael Schwarz,Computer science (0.81); Microarchitecture (0.72); x86 (0.58),"The recent Spectre attack first showed how to inject incorrect branch targets into a victim domain by poisoning microarchitectural branch prediction history. In this paper, we generalize injection-based methodologies to the memory hierarchy by directly injecting incorrect, attacker-controlled values...",
compilers,2020,8,https://openalex.org/W3007855180,A Survey of Compiler Testing,Junjie Chen; Jibesh Patra; Michael Pradel,Compiler (0.93); Computer science (0.88); Compiler correctness (0.87),"Virtually any software running on a computer has been processed by a compiler or a compiler-like tool. Because compilers are such a crucial piece of infrastructure for building software, their correctness is of paramount importance. To validate and increase the correctness of compilers, significant ...",ACM Computing Surveys
compilers,2020,9,https://openalex.org/W3004659153,The Deep Learning Compiler: A Comprehensive Survey,Mingzhen Li; Yi Liu; Xiaoyan Liu,Compiler (0.92); Computer science (0.80); Deep learning (0.79),"The difficulty of deploying various deep learning (DL) models on diverse DL hardware has boosted the research and development of DL compilers in the community. Several DL compilers have been proposed from both industry and academia such as Tensorflow XLA and TVM. Similarly, the DL compilers take the...",IEEE Transactions on Parallel and Distributed Systems
compilers,2020,10,https://openalex.org/W4288083528,Interstellar,Xuan Yang; Mingyu Gao; Qiaoyi Liu,Computer science (0.86); Nested loop join (0.74); Compiler (0.66),"We show that DNN accelerator micro-architectures and their program mappings represent specific choices of loop order and hardware parallelism for computing the seven nested loops of DNNs, which enables us to create a formal taxonomy of all existing dense DNN accelerators. Surprisingly, the loop tran...",
compilers,2020,11,https://openalex.org/W3017521908,"MAESTRO: A Data-Centric Approach to Understand Reuse, Performance, and Hardware Cost of DNN Mappings",Hyoukjun Kwon; Prasanth Chatarasi; Vivek Sarkar,Computer science (0.89); Compiler (0.68); Reuse (0.66),"The efficiency of an accelerator depends on three factors-mapping, deep neural network (DNN) layers, and hardware-constructing extremely complicated design space of DNN accelerators. To demystify such complicated design space and guide the DNN accelerator design for better efficiency, we propose an ...",IEEE Micro
compilers,2020,12,https://openalex.org/W2998785217,Efficient and Interpretable Deep Blind Image Deblurring Via Algorithm Unrolling,Yuelong Li; Mohammad Tofighi; Junyi Geng,Deblurring (0.94); Computer science (0.77); Loop unrolling (0.68),"Blind image deblurring remains a topic of enduring interest. Learning based approaches, especially those that employ neural networks have emerged to complement traditional model based methods and in many cases achieve vastly enhanced performance. That said, neural network approaches are generally em...",IEEE Transactions on Computational Imaging
compilers,2020,13,https://openalex.org/W3015998244,A Survey on Coarse-Grained Reconfigurable Architectures From a Performance Perspective,Artur Podobas; Kentaro Sano; Satoshi Matsuoka,Computer science (0.87); Compiler (0.62); Parallel computing (0.51),"With the end of both Dennard's scaling and Moore's law, computer users and researchers are aggressively exploring alternative forms of computing in order to continue the performance scaling that we have come to enjoy. Among the more salient and practical of the post-Moore alternatives are reconfigur...",IEEE Access
compilers,2020,14,https://openalex.org/W3042501387,DSAGEN: Synthesizing Programmable Spatial Accelerators,Jian Weng; Sihao Liu; Vidushi Dadu,Computer science (0.80); Compiler (0.76); Modular design (0.64),"Domain-specific hardware accelerators can provide orders of magnitude speedup and energy efficiency over general purpose processors. However, they require extensive manual effort in hardware design and software stack development. Automated ASIC generation (eg. HLS) can be insufficient, because the h...",
compilers,2020,15,https://openalex.org/W3015291177,RetroWrite: Statically Instrumenting COTS Binaries for Fuzzing and Sanitization,S. Dinesh; Nathan Burow; Dongyan Xu,Fuzz testing (0.88); Computer science (0.86); Instrumentation (computer programming) (0.66),"Analyzing the security of closed source binaries is currently impractical for end-users, or even developers who rely on third-party libraries. Such analysis relies on automatic vulnerability discovery techniques, most notably fuzzing with sanitizers enabled. The current state of the art for applying...",
compilers,2020,16,https://openalex.org/W3107362213,Random testing for C and C++ compilers with YARPGen,Vsevolod Livinskii; Dmitry Babokin; John Regehr,Compiler (0.89); Computer science (0.88); Fuzz testing (0.78),"Compilers should not crash and they should not miscompile applications. Random testing is an effective method for finding compiler bugs that have escaped other kinds of testing. This paper presents Yet Another Random Program Generator (YARPGen), a random test-case generator for C and C++ that we use...",Proceedings of the ACM on Programming Languages
compilers,2020,17,https://openalex.org/W3007772124,MLIR: A Compiler Infrastructure for the End of Moore's Law,Chris Lattner; Mehdi Amini; Uday Bondhugula,Compiler (0.77); Computer science (0.52); End-to-end principle (0.47),"This work presents MLIR, a novel approach to building reusable and extensible compiler infrastructure. MLIR aims to address software fragmentation, improve compilation for heterogeneous hardware, significantly reduce the cost of building domain specific compilers, and aid in connecting existing comp...",arXiv (Cornell University)
